Key,Item Type,Publication Year,Author,Title,Publication Title,DOI,Url,Abstract Note,Date,Publisher,Place,Manual Tags,Automatic Tags,Conference Name,Cited by
S3GZS4C3,journalArticle,2024,"Molla, Md Monirul Islam; Ahmad, Johanna; Wan Kadir, Wan Mohd Nasir",A Comparison of Transforming the User Stories and Functional Requirements into UML Use Case Diagram,International Journal of Innovative Computing,10.11113/ijic.v14n1.463,https://ijic.utm.my/index.php/ijic/article/view/463,"Software development life cycle is a continuous process for every developer community, including establishing the user requirements and system design until software maintenance. The system design phase contains the transformation of all-natural language requirements into models. The Unified Modelling Language (UML) use case model is regarded as one of the most helpful diagrams for a software developer to understand the higher version of the software blueprint. It’s very useful to reflects the business requirements for any proposed software system. Manual analysis requires significant time and effort, highlighting the need for automated assistance. This study aims to enhance the machine learning techniques that have been utilized to transform user stories and functional requirements into a UML use case diagram. This research also investigate the use of an automated Natural Language Processing (NLP) tool and framework for mapping use case diagram elements from user stories and functional requirements written in natural languages. The proposed approach using a NLP based machine learning framework called BERT to predict and extract actors, use cases, and the relationship between actors and use cases. This approach has been applicable for both user stories and functional requirements. A dataset has been pre-processed in order to train this model and collected from various sources like Kaggle, software projects. There are 11 user stories and 11 functional requirements were selected to test the proposed solution. The data set from benchmark repositories. The extracted results during the whole NLP process are then mapped into actors, use cases, and relationships. This study was evaluated using both accuracy and precision values for performance measures. By applying NLP technologies, this research offers complete support for extracting elements and generating a use case diagram and revealed the 88% accuracy and 88% precision.",2024-05-31,,,,,,0
G4EBK5V9,conferencePaper,2017,"Ferrari, Alessio; Spagnolo, Giorgio Oronzo; Gnesi, Stefania",PURE: A Dataset of Public Requirements Documents,2017 IEEE 25th International Requirements Engineering Conference (RE),10.1109/RE.2017.29,http://ieeexplore.ieee.org/document/8049173/,"This paper presents PURE (PUblic REquirements dataset), a dataset of 79 publicly available natural language requirements documents collected from the Web. The dataset includes 34,268 sentences and can be used for natural language processing tasks that are typical in requirements engineering, such as model synthesis, abstraction identiﬁcation and document structure assessment. It can be further annotated to work as a benchmark for other tasks, such as ambiguity detection, requirements categorisation and identiﬁcation of equivalent requirements. In the paper, we present the dataset and we compare its language with generic English texts, showing the peculiarities of the requirements jargon, made of a restricted vocabulary of domain-speciﬁc acronyms and words, and long sentences. We also present the common XML format to which we have manually ported a subset of the documents, with the goal of facilitating replication of NLP experiments.",2017-09,IEEE,"Lisbon, Portugal",,,2017 IEEE 25th International Requirements Engineering Conference (RE),181
ANMLTNQR,conferencePaper,2018,"Alhoshan, Waad; Batista-Navarro, Riza; Zhao, Liping",Towards a Corpus of Requirements Documents Enriched with Semantic Frame Annotations,2018 IEEE 26th International Requirements Engineering Conference (RE),10.1109/RE.2018.00055,https://ieeexplore.ieee.org/document/8491162/,"Software requirements are typically written in natural language, which need to be transformed into a more formal representation. Natural language processing techniques have been applied to aid in this transformation. Semantic parsing, for instance, adds semantic structure to text. It however requires supporting corpora which are still missing in requirements engineering. To address this gap, we developed FN-RE, a corpus of requirements documents, which was annotated based on semantic frames in FrameNet. Each requirement statement was manually labelled by two annotators by selecting suitable semantic frames and related frame elements. We obtained an average agreement of 72.85% between the two annotators, measured by F-score, thus indicating that the annotations provided in our corpus are reliable.",2018-08,IEEE,"Banff, AB",,,2018 IEEE 26th International Requirements Engineering Conference (RE),8
SHIME8YF,conferencePaper,2021,"A. Abdelnabi, Esra; M. Maatuk, Abdelsalam; M. Abdelaziz, Tawfig",An Algorithmic Approach for Generating Behavioral UML Models Using Natural Language Processing,The 7th International Conference on Engineering & MIS 2021,10.1145/3492547.3492612,https://dl.acm.org/doi/10.1145/3492547.3492612,"The process of transformation from informal requirements stated in natural language into a formal specification such as Unified Modeling Language (UML) is an important challenge. User requirements that are expressed in natural language can be very problematic, which makes the requirements analysis a difficult task. In this paper, we propose a method to analyze the natural language requirements and generate sequence and collaboration diagrams from these requirements, which are commonly used to describe the behavior of software systems. A case study was accomplished to compare the diagrams generated by the proposed approach to the diagrams produced by other approaches. The results showed that the elements of the sequence and collaboration diagrams extracted through our approach are very satisfactory and they would be acceptable as initial analysis models.",2021-10-11,ACM,Almaty Kazakhstan,,,ICEMIS'21: The 7th International Conference on Engineering & MIS 2021,7
HGGUUD56,conferencePaper,2009,"Deeptimahanti, Deva Kumar; Babar, Muhammad Ali",An Automated Tool for Generating UML Models from Natural Language Requirements,2009 IEEE/ACM International Conference on Automated Software Engineering,10.1109/ASE.2009.48,http://ieeexplore.ieee.org/document/5431706/,"This paper describes a domain independent tool, named, UML Model Generator from Analysis of Requirements (UMGAR), which generates UML models like the Use-case Diagram, Analysis class model, Collaboration diagram and Design class model from natural language requirements using efficient Natural Language Processing (NLP) tools. UMGAR implements a set of syntactic reconstruction rules to process complex requirements into simple requirements. UMGAR also provides a generic XMI parser to generate XMI files for visualizing the generated models in any UML modeling tool. With respect to the existing tools in this area, UMGAR provides more comprehensive support for generating models with proper relationships, which can be used for large requirement documents.",2009-11,IEEE,"Auckland, New Zealand",,,2009 24th IEEE/ACM International Conference on Automated Software Engineering (ASE),152
3ZNED3EC,conferencePaper,2018,"Wangoo, Divanshi Priyadarshni",Artificial Intelligence Techniques in Software Engineering for Automated Software Reuse and Design,2018 4th International Conference on Computing Communication and Automation (ICCCA),10.1109/CCAA.2018.8777584,https://ieeexplore.ieee.org/document/8777584/,"Mining of software engineering data have proved successful for reusability of components in software development. Artificial Intelligence improves a large application domain of software engineering activities. Intelligent knowledge discovery integrates Artificial Intelligence with Data Mining for intelligent computing of software engineering tasks. The integration of artificial intelligence with data mining for supporting software engineering applications leads to Software Intelligence. This paper analyzes three artificial intelligence techniques that uses data mining, business intelligence, machine learning for promoting automated software reuse for software construction and overall software development. The business intelligence tools are used for intelligent knowledge discovery of code that will be used for reusability of applications and components. An analysis of several AI techniques in software reuse domain of software engineering is discussed for automated software reuse and identification of potential research prospects in the field.",2018-12,IEEE,"Greater Noida, India",,,2018 4th International Conference on Computing Communication and Automation (ICCCA),41
S5N2HUUU,journalArticle,2024,"Necula, Sabina-Cristiana; Dumitriu, Florin; Greavu-Șerban, Valerică",A Systematic Literature Review on Using Natural Language Processing in Software Requirements Engineering,Electronics,10.3390/electronics13112055,https://www.mdpi.com/2079-9292/13/11/2055,"This systematic literature review examines the integration of natural language processing (NLP) in software requirements engineering (SRE) from 1991 to 2023. Focusing on the enhancement of software requirement processes through technological innovation, this study spans an extensive array of scholarly articles, conference papers, and key journal and conference reports, including data from Scopus, IEEE Xplore, ACM Digital Library, and Clarivate. Our methodology employs both quantitative bibliometric tools, like keyword trend analysis and thematic mapping, and qualitative content analysis to provide a robust synthesis of current trends and future directions. Reported findings underscore the essential roles of advanced computational techniques like machine learning, deep learning, and large language models in refining and automating SRE tasks. This review highlights the progressive adoption of these technologies in response to the increasing complexity of software systems, emphasizing their significant potential to enhance the accuracy and efficiency of requirement engineering practices while also pointing to the challenges of integrating artificial intelligence (AI) and NLP into existing SRE workflows. The systematic exploration of both historical contributions and emerging trends offers new insights into the dynamic interplay between technological advances and their practical applications in SRE.",2024-05-24,,,,,,2
YXTTI2ZQ,conferencePaper,2024,"Jahan, Munima; Hassan, Mohammad Mahdi; Golpayegani, Reza; Ranjbaran, Golshid; Roy, Chanchal; Roy, Banani; Schneider, Kevin",Automated Derivation of UML Sequence Diagrams from User Stories: Unleashing the Power of Generative AI vs. a Rule-Based Approach,Proceedings of the ACM/IEEE 27th International Conference on Model Driven Engineering Languages and Systems,10.1145/3640310.3674081,https://dl.acm.org/doi/10.1145/3640310.3674081,"User stories are informal, non-technical descriptions of features from a user’s perspective that guide collaboration and iterative development in Agile projects. However, ambiguities in user stories can lead to miscommunication among stakeholders. Design models, such as UML sequence diagrams, are essential for enhancing communication, clarifying system behavior, and improving the development process. This paper presents an automated approach for generating behavioral models specifically sequence diagrams from natural language requirements expressed as user stories. We also investigate the effectiveness of a Large Language Model (LLM) in using generative AI for this task. By applying our approach and ChatGPT to two benchmark datasets with the same set of user stories, we generated corresponding sequence diagrams for comparison. Expert evaluations in Software Engineering reveal that our approach effectively produces relevant, simplified diagrams for straightforward user stories, whereas the LLM tends to create more complex diagrams that sometimes go beyond the simplicity of the original user stories.",2024-09-22,ACM,Linz Austria,,,MODELS '24: ACM/IEEE 27th International Conference on Model Driven Engineering Languages and Systems,0
B6IINTQR,conferencePaper,2022,"Ahmed, Sharif; Ahmed, Arif; Eisty, Nasir U.",Automatic Transformation of Natural to Unified Modeling Language: A Systematic Review,"2022 IEEE/ACIS 20th International Conference on Software Engineering Research, Management and Applications (SERA)",10.1109/SERA54885.2022.9806783,http://arxiv.org/abs/2204.00932,"Context: Processing Software Requirement Speciﬁcations (SRS) manually takes a much longer time for requirement analysts in software engineering. Researchers have been working on making an automatic approach to ease this task. Most of the existing approaches require some intervention from an analyst or are challenging to use. Some automatic and semi-automatic approaches were developed based on heuristic rules or machine learning algorithms. However, there are various constraints to the existing approaches to UML generation, such as restrictions on ambiguity, length or structure, anaphora, incompleteness, atomicity of input text, requirements of domain ontology, etc. . Objective: This study aims to better understand the effectiveness of existing systems and provide a conceptual framework with further improvement guidelines. Method: We performed a systematic literature review (SLR). We conducted our study selection into two phases and selected 70 papers. We conducted quantitative and qualitative analyses by manually extracting information, cross-checking, and validating our ﬁndings. Result: We described the existing approaches and revealed the issues observed in these works. We identiﬁed and clustered both the limitations and beneﬁts of selected articles. Conclusion: This research upholds the necessity of a common dataset and evaluation framework to extend the research consistently. It also describes the signiﬁcance of natural language processing obstacles researchers face. In addition, it creates a path forward for future research.",2022-05-25,,,,Computer Science - Software Engineering,,4
U27JFDFV,conferencePaper,2017,"Jaiwai, Mathawan; Sammapun, Usa",Extracting UML class diagrams from software requirements in Thai using NLP,2017 14th International Joint Conference on Computer Science and Software Engineering (JCSSE),10.1109/JCSSE.2017.8025938,http://ieeexplore.ieee.org/document/8025938/,"In software development, requirements, normally written in natural language, are documents that specify what users want in software products. Software developers then analyze these requirements to create domain models represented in UML diagrams in an attempt to comprehend what users need in the software products. These domain models are usually converted into design models and finally carried over into classes in source code. Thus, domain models have an impact on the final software products. However, creating correct domain models can be difficult when software developers are not skilled. Moreover, even for skilled developers, when requirements are large, wading through all requirements to create domain models can take times and might result in errors. Therefore, researchers have studied various approaches to apply natural language processing techniques to transform requirements written in natural language into UML diagrams. Those researches focus on requirements written in English. This paper proposes an approach to process requirements written in Thai to extract UML class diagrams using natural language processing techniques. The UML class diagram extraction is based on transformation rules that identify classes and attributes from requirements. The results are evaluated with recall and precision using truth values created by humans. Future works include identifying operations and relationships from requirements to complete class diagram extraction. Our research should benefit Thai software developers by reducing time in requirement analysis and also helping novice software developers to create correct domain models represented in UML class diagram.",2017-07,IEEE,"NakhonSiThammarat, Thailand",,,2017 14th International Joint Conference on Computer Science and Software Engineering (JCSSE),19
P9YWSPEG,journalArticle,2017,"Dawood, Omer Salih; Sahraoui, Abd-El-Kader",From Requirements Engineering to UML using Natural Language Processing – Survey Study,European Journal of Engineering Research and Science,10.24018/ejers.2017.2.1.236,http://ejers.org/index.php/ejers/article/view/236,"In the paper process of moving from software requirements to Unified Modeling Language (UML) diagrams has been studied. It shows the importance of this process and discusses many comparative studies in the field. A questionnaire related to the study was distributed worldwide to many research groups, academia, and industry to know the current status of using requirement management tools, knowledge of using UML in software development, frequently used UML diagrams, and the methodology used to generate UML diagrams from requirements. The paper emphasises that there is a need to do some important research in the area of requirements Natural Language processing (NLP) to obtain UML diagrams, and generalize process of using automatic or semi-automatic methodology to generate UML diagrams from requirements.",2017-01-23,,,,,,3
SQ34MNUM,conferencePaper,2021,"Abdelnabi, Esra A.; Maatuk, Abdelsalam M.; Hagal, Mohammed",Generating UML Class Diagram from Natural Language Requirements: A Survey of Approaches and Techniques,2021 IEEE 1st International Maghreb Meeting of the Conference on Sciences and Techniques of Automatic Control and Computer Engineering MI-STA,10.1109/MI-STA52233.2021.9464433,https://ieeexplore.ieee.org/document/9464433/,"In the last years, many methods and tools for generating Unified Modeling Language (UML) class diagrams from natural language (NL) software requirements. These methods and tools deal with the transformation of NL textual requirements to UML diagrams. The transformation process involves analyzing NL requirements and extracting relevant information from the text to generate UML class models. This paper aims to survey the existing works of transforming textual requirements into UML class models to indicate their strengths and limitations. The paper provides a comprehensive explanation and evaluation of the existing approaches and tools. The automation degree, efficiency, and completeness, as well as the used techniques, are studied and analyzed. The study demonstrated the necessity of automating the process, in addition to combining artificial intelligence with engineering requirements and using Natural Language Processing (NLP) techniques to extract class diagrams from NL requirements.",2021-05-25,IEEE,"Tripoli, Libya",,,2021 IEEE 1st International Maghreb Meeting of the Conference on Sciences and Techniques of Automatic Control and Computer Engineering MI-STA,29
64U5GT2E,conferencePaper,2020,"Abdelnabi, Esra A.; Maatuk, Abdelsalam M.; Abdelaziz, Tawfig M.; Elakeili, Salwa M.",Generating UML Class Diagram using NLP Techniques and Heuristic Rules,2020 20th International Conference on Sciences and Techniques of Automatic Control and Computer Engineering (STA),10.1109/STA50679.2020.9329301,https://ieeexplore.ieee.org/document/9329301/,"Several tools and approaches have been proposed to generate Unified Modeling Language (UML) diagrams. Researchers focus on automating the process of extracting valuable information from Natural Language (NL) text to generate UML models. The existing approaches show less accurateness because of the ambiguity of NL. In this paper, we present a method for generation class models from software specification requirements using NL practices and a set of heuristic rules to facilitate the transformation process. The NL requirements are converted into a formal and controlled representation to increase the accuracy of the generated class diagram. A set of pre-defined rules has been developed to extract OO concepts such as classes, attributes, methods, and relationships to generate a UML class diagram from the given requirements specifications. The approach has been applied and evaluated practically, where the results show that the approach is both feasible and acceptable.",2020-12-20,IEEE,"Monastir, Tunisia",,,2020 20th International Conference on Sciences and Techniques of Automatic Control and Computer Engineering (STA),37
4CRVQXRQ,conferencePaper,2021,"M. Maatuk, Abdelsalam; A. Abdelnabi, Esra",Generating UML Use Case and Activity Diagrams Using NLP Techniques and Heuristics Rules,"International Conference on Data Science, E-learning and Information Systems 2021",10.1145/3460620.3460768,https://dl.acm.org/doi/10.1145/3460620.3460768,"The process of generating Unified Modeling Language (UML) Diagrams from Natural Language (NL) requirements is considered a complex and challenging task. Software requirements specification is often written in NL format, which causes potential problems. Requirement’s analysts analyze and process natural language requirements manually to extract the UML elements. The manual analysis takes a lot of time and effort, which justifies the need for automated support. This paper proposes an approach to facilitate the NL requirements analysis process and UML diagrams extraction from NL textual requirements using natural language processing (NLP) techniques and heuristics rules. This approach focuses on generating use-case and activity diagrams. The approach has been applied to a case study and evaluated through an experimental. The evaluation of the approach will be conducted through a comparative study. The experimental results prove that the proposed approach is considerably improved as compared to the other approaches.",2021-04-05,ACM,Ma'an Jordan,,,"DATA'21: International Conference on Data Science, E-learning and Information Systems 2021",34
BC5EYID9,journalArticle,2024,"Herwanto, Guntur Budi; Quirchmayr, Gerald; Tjoa, A. Min",Leveraging NLP Techniques for Privacy Requirements Engineering in User Stories,IEEE Access,10.1109/ACCESS.2024.3364533,https://ieeexplore.ieee.org/document/10430095/,"Privacy requirements engineering acts as a role to systematically elicit privacy requirements from system requirements and legal requirements such as the GDPR. Many methodologies have been proposed, but the majority of them are focused on the waterfall approach, making adopting privacy engineering in agile software development difficult. The other major issue is that the process currently is to a high degree manual. This paper focuses on closing these gaps through the development of a machine learning-based approach for identifying privacy requirements in an agile software development environment, employing natural language processing (NLP) techniques. Our method aims to allow agile teams to focus on functional requirements while NLP tools assist them in generating privacy requirements. The main input for our method is a collection of user stories, which are typically used to identify functional requirements in agile software development. The NLP approach is then used to automate some human-intensive tasks such as identifying personal data and creating data flow diagrams from user stories. The data flow diagram forms the basis for the automatic creation of privacy requirements. Our evaluation shows that our NLP method achieves a fairly good performance in terms of F-Measure. We are also demonstrate the feasibility of our NLP approach in CamperPlus project. Lastly, we are developing a tool to integrate our NLP approach into the privacy requirements engineering pipeline, allowing for manual editing of results so that agile teams can maintain control over the automated approach.",2024,,,,,,5
SVLE4BPS,conferencePaper,2021,"Bashir, Nauman; Bilal, Muhammad; Liaqat, Misbah; Marjani, Mohsen; Malik, Nadia; Ali, Mohsin",Modeling Class Diagram using NLP in Object-Oriented Designing,2021 National Computing Colleges Conference (NCCC),10.1109/NCCC49330.2021.9428817,https://ieeexplore.ieee.org/document/9428817/,"Requirement’s analysis and design is a multifaceted and time-consuming process. The success of software projects critically relies on careful & timely analysis and modeling of system requirements. Mostly, the requirements gathered from the stakeholders are written in some language (probably English). In this regard, significant manual efforts are required for the formation of good class model which unfortunately results in time delays in the software industry. The problems associated with the requirement analysis and class modeling can be overcome by the appropriate employment of machine learning. In this paper, we propose a system, requirement engineering analysis & design (READ) to generate unified modeling language (UML) class diagram using natural language processing (NLP) and domain ontology techniques. We have implemented the READ system in Python and it successfully generates the UML class diagram i.e., class name, attributes methods, and relationships from the textual requirements written in English. To assess the performance of the proposed system, we have evaluated it on publicly available standards and the experimental results show that it outperforms the existing techniques for object-oriented based software designing.",2021-03-27,IEEE,"Taif, Saudi Arabia",,,2021 National Computing Colleges Conference (NCCC),18
