Key,Item Type,Publication Year,Author,Title,Publication Title,DOI,Url,Abstract Note,Date,Publisher,Place,Manual Tags,Automatic Tags,Conference Name,Cited by
YAQMN48D,conferencePaper,1996,"Osborne, M.; MacNish, C.K.",Processing natural language software requirement specifications,Proceedings of the Second International Conference on Requirements Engineering,10.1109/ICRE.1996.491451,http://ieeexplore.ieee.org/document/491451/,"Ambiguity in requirement speci cations causes numerous problems; for example in de ning customer/supplier contracts, ensuring the integrity of safetycritical systems, and analysing the implications of system change requests. A direct appeal to formal speci cation has not solved these problems, partly because of the restrictiveness and lack of habitability of formal languages. An alternative approach, described in this paper, is to use natural language processing (NLP) techniques to aid the development of formal descriptions from requirements expressed in contolled natural language. While many problems in NLP remain to be solved, we show that suitable extensions to existing tools provide a useful platform for detecting and resolving ambiguities. Our system is demonstrated through a case-study on a simple requirements speci cation.",1996,IEEE Comput. Soc. Press,"Colorado Springs, CO, USA",,,Second International Conference on Requirements Engineering,118
ZHAEWMSK,journalArticle,2019,"Gupta, Som; Gupta, S K",Natural language processing in mining unstructured data from software repositories: a review,Sādhanā,10.1007/s12046-019-1223-9,http://link.springer.com/10.1007/s12046-019-1223-9,"With the increasing popularity of open-source platforms, software data is easily available from various open-source tools like GitHub, CVS, SVN, etc. More than 80 percent of the data present in them is unstructured. Mining data from these repositories helps project managers, developers and businesses, in getting interesting insights. Most of the software artefacts present in these repositories are in the natural language form, which makes natural language processing (NLP) an important part of mining to get the useful results. The paper reviews the application of NLP techniques in the ﬁeld of Mining Software Repositories (MSR). The paper mainly focuses on sentiment analysis, summarization, traceability, norms mining and mobile analytics. The paper presents the major NLP works performed in this area by surveying the research papers from 2000 to 2018. The paper ﬁrstly describes the major artefacts present in the software repositories where the NLP techniques have been applied. Next, the paper presents some popular open-source NLP tools that have been used to perform NLP tasks. Later the paper discusses, in brief, the research state of NLP in MSR ﬁeld. The paper also lists down the various challenges along with the pointers for future work in this ﬁeld of research and ﬁnally the conclusion.",2019-12,,,,,,16
R5HA5SMJ,journalArticle,2018,"Elallaoui, Meryem; Nafil, Khalid; Touahni, Raja",Automatic Transformation of User Stories into UML Use Case Diagrams using NLP Techniques,Procedia Computer Science,10.1016/j.procs.2018.04.010,https://linkinghub.elsevier.com/retrieve/pii/S1877050918303600,,2018,,,,,,138
HM7QUPG8,journalArticle,2009,"Bajwa, Imran Sarwar; Samad, Ali; Mumtaz, Shahzad",Object Oriented Software Modeling Using NLP Based Knowledge Extraction,,,https://abdn.elsevierpure.com/en/publications/object-oriented-software-modeling-using-nlp-based-knowledge-extra,"This paper presents a natural language processing based automated system for NL text to OO modeling the user requirements and generating code in multi-languages. A new rule-based model is presented for analyzing the natural languages (NL) and extracting the relative and required information from the given software requirement notes by the user. User writes the requirements in simple English in a few paragraphs and the designed system incorporates NLP methods to analyze the given script. First the NL text is semantically analyzed to extract classes, objects and their respective, attributes, methods and associations. Then UML diagrams are generated on the bases of previously extracted information. The designed system also provides with the respective code automatically of the already generated diagrams. The designed system provides a quick and reliable way to generate UML diagrams to save the time and budget of both the user and system analyst.",2009,,,,,,85
DVMXG6WC,conferencePaper,2011,"Deeptimahanti, Deva Kumar; Sanyal, Ratna",Semi-automatic generation of UML models from natural language requirements,Proceedings of the 4th India Software Engineering Conference,10.1145/1953355.1953378,https://dl.acm.org/doi/10.1145/1953355.1953378,"Going from requirements analysis to design phase is considered as one of the most complex and difficult activities in software development. Errors caused during this activity can be quite expensive to fix in later phases of software development. One main reason for such potential problems is due to the specification of software requirements in Natural Language format. To overcome some of these defects we have proposed a technique, which aims to provide semi- automated assistance for developers to generate UML models from normalized natural language requirements using Natural Language Processing techniques. This technique initially focuses on generating use-case diagram and analysis class model (conceptual model) followed by collaboration model generation for each use-case. Then it generates a consolidated design class model from which code model can also be generated. It also provides requirement traceability both at design and code levels by using Key-Word-InContext and Concept Location techniques respectively to identify inconsistencies in requirements. Finally, this technique generates XML Metadata Interchange (XMI) files for visualizing generated models in any UML modeling tool having XMI import feature. This paper is an extension to our existing work by enhancing its complete usage with the help of Qualification Verification System as a case study.",2011-02-24,ACM,Thiruvananthapuram Kerala India,,,ISEC '11: Indian Software Engineering Conference,154
NEDBK3H6,conferencePaper,2010,"Tichy, Walter F.; Koerner, Sven J.",Text to software: developing tools to close the gaps in software engineering,Proceedings of the FSE/SDP workshop on Future of software engineering research,10.1145/1882362.1882439,https://dl.acm.org/doi/10.1145/1882362.1882439,"Software development relies heavily on manual processes for transforming requirements into software artifacts such as models, source code, or test cases. Requirements are the starting point for these transformations, and they are typically written in natural language. However, hardly any automated tools exist that translate natural language texts into software artifacts.",2010-11-07,ACM,Santa Fe New Mexico USA,,,SIGSOFT/FSE'10: 18th ACM SIGSOFT Symposium on the Foundations of Software Engineering,28
AVHEBPTL,journalArticle,2012,"D.Joshi, S.; Deshpande, Dhanraj",Textual Requirement Analysis for UML Diagram Extraction by using NLP,International Journal of Computer Applications,10.5120/7795-0906,http://research.ijcaonline.org/volume50/number8/pxc3880906.pdf,"Requirement analysis is the preliminary step in software development process. The requirements stated by the clients are analyzed and an abstraction of it, is created which is termed as requirement model. The automatic generation of UML diagram from natural language requirements is highly challenging and demanding very efficient methodology. Unified Modeling Language (UML) models are helpful for understanding the problems, communicating with application experts and preparing documentation. The static design view of the system can be modeled using a UML class diagram. System requirements stated by the user are usually in natural language form. This is an imprecise and inconsistent form which is difficult to be used by the developer for design UML model. We present a new methodology for generating UML diagrams or models from natural language problem statement or requirement specification. We have named our methodology as Requirement analysis and UML diagram extraction (RAUE).",2012-07-28,,,,,,39
QEJIX9TF,book,2015,"Seidl, Martina; Scholz, Marion; Huemer, Christian; Kappel, Gerti",UML @ Classroom: An Introduction to Object-Oriented Modeling,,,https://link.springer.com/10.1007/978-3-319-12742-2,,2015,Springer International Publishing,Cham,,,,226
JYK4AB63,preprint,2021,"Lu, Shuai; Guo, Daya; Ren, Shuo; Huang, Junjie; Svyatkovskiy, Alexey; Blanco, Ambrosio; Clement, Colin; Drain, Dawn; Jiang, Daxin; Tang, Duyu; Li, Ge; Zhou, Lidong; Shou, Linjun; Zhou, Long; Tufano, Michele; Gong, Ming; Zhou, Ming; Duan, Nan; Sundaresan, Neel; Deng, Shao Kun; Fu, Shengyu; Liu, Shujie",CodeXGLUE: A Machine Learning Benchmark Dataset for Code Understanding and Generation,,,http://arxiv.org/abs/2102.04664,"Benchmark datasets have a significant impact on accelerating research in programming language tasks. In this paper, we introduce CodeXGLUE, a benchmark dataset to foster machine learning research for program understanding and generation. CodeXGLUE includes a collection of 10 tasks across 14 datasets and a platform for model evaluation and comparison. CodeXGLUE also features three baseline systems, including the BERT-style, GPT-style, and Encoder-Decoder models, to make it easy for researchers to use the platform. The availability of such data and baselines can help the development and validation of new methods that can be applied to various program understanding and generation problems 1.",2021-03-16,arXiv,,,Computer Science - Software Engineering; Computer Science - Computation and Language,,769
JTQXE4IJ,journalArticle,2017,"Ferrari, Alessio; Dell'Orletta, Felice; Esuli, Andrea; Gervasi, Vincenzo; Gnesi, Stefania",Natural Language Requirements Processing: A 4D Vision,IEEE Software,10.1109/MS.2017.4121207,https://ieeexplore.ieee.org/document/8106888/,,2017-11,,,,,,75
ES2QABHE,conferencePaper,2024,"Ouaddi, Charaf; Benaddi, Lamya; Souha, Adnane; Jakimi, Abdeslam; Ouchao, Brahim",A sketch of an approach for discovering UML use-case diagrams from textual specifications of systems using a chatbot,"2024 IEEE 12th International Symposium on Signal, Image, Video and Communications (ISIVC)",10.1109/ISIVC61350.2024.10577821,https://ieeexplore.ieee.org/document/10577821/,,2024-05-21,IEEE,"Marrakech, Morocco",,,"2024 IEEE 12th International Symposium on Signal, Image, Video and Communications (ISIVC)",1
EH4J4CCM,bookSection,2017,"Ahmed, Mudassar Adeel; Butt, Wasi Haider; Ahsan, Imran; Anwar, Muhammad Waseem; Latif, Muhammad; Azam, Farooque",A Novel Natural Language Processing (NLP) Approach to Automatically Generate Conceptual Class Model from Initial Software Requirements,Information Science and Applications 2017,,http://link.springer.com/10.1007/978-981-10-4154-9_55,,2017,Springer Singapore,Singapore,,,,11
YKRP5XX5,conferencePaper,2024,"Babaalla, Zakaria; Bouziane, El Mahi; Jakimi, Abdeslam; Oualla, Moahmed",From text-based system specifications to UML diagrams: A bridge between words and models,"2024 International Conference on Circuit, Systems and Communication (ICCSC)",10.1109/ICCSC62074.2024.10616686,https://ieeexplore.ieee.org/document/10616686/,,2024-06-28,IEEE,"Fes, Morocco",,,"2024 International Conference on Circuit, Systems and Communication (ICCSC)",0
DBGLJADH,conferencePaper,2024,"Babaalla, Zakaria; Jakimi, Abdeslam; Oualla, Mohamed; Saadane, Rachid; Chehri, Abdellah",Towards an Automatic Extracting UML Class Diagram from System's Textual Specification,"Proceedings of the 7th International Conference on Networking, Intelligent Systems and Security",10.1145/3659677.3659742,https://dl.acm.org/doi/10.1145/3659677.3659742,,2024-04-18,ACM,Meknes AA Morocco,,,"NISS 2024: The 7th International Conference On Networking, Intelligents Systems and Security",1
XMU2MB7N,bookSection,2019,"Maqbool, Bilal; Azam, Farooque; Anwar, Muhammad Waseem; Butt, Wasi Haider; Zeb, Jahan; Zafar, Iqra; Nazir, Aiman Khan; Umair, Zuneera","A Comprehensive Investigation of BPMN Models Generation from Textual Requirements—Techniques, Tools and Trends",Information Science and Applications 2018,,http://link.springer.com/10.1007/978-981-13-1056-0_54,,2019,Springer Singapore,Singapore,,,,37
LRN9L4GW,journalArticle,2023,"Schäfer, Bernhard; Van Der Aa, Han; Leopold, Henrik; Stuckenschmidt, Heiner",Sketch2Process: End-to-End BPMN Sketch Recognition Based on Neural Networks,IEEE Transactions on Software Engineering,10.1109/TSE.2022.3228308,https://ieeexplore.ieee.org/document/9980425/,,2023-04-01,,,,,,9
2KWFGAQD,journalArticle,2023,"Nasiri, Samia; Adadi, Amina; Lahmer, Mohammed",Automatic generation of business process models from user stories,International Journal of Electrical and Computer Engineering (IJECE),10.11591/ijece.v13i1.pp809-822,https://ijece.iaescore.com/index.php/IJECE/article/view/27489,"In this paper, we propose an automated approach to extract business process models from requirements, which are presented as user stories. In agile software development, the user story is a simple description of the functionality of the software. It is presented from the user's point of view and is written in natural language. Acceptance criteria are a list of specifications on how a new software feature is expected to operate. Our approach analyzes a set of acceptance criteria accompanying the user story, in order, first, to automatically generate the components of the business model, and then to produce the business model as an activity diagram which is a unified modeling language (UML) behavioral diagram. We start with the use of natural language processing (NLP) techniques to extract the elements necessary to define the rules for retrieving artifacts from the business model. These rules are then developed in Prolog language and imported into Python code. The proposed approach was evaluated on a set of use cases using different performance measures. The results indicate that our method is capable of generating correct and accurate process models.",2023-02-01,,,,,,13
UZNSNWQ7,journalArticle,2024,"Babaalla, Zakaria; Abdelmalek, Hamza; Jakimi, Abdeslam; Oualla, Mohamed",Extraction of UML class diagrams using deep learning: Comparative study and critical analysis,Procedia Computer Science,10.1016/j.procs.2024.05.053,https://linkinghub.elsevier.com/retrieve/pii/S187705092401069X,"Several approaches and tools have been proposed to facilitate the automatic generation of Unified Modeling Language (UML) class diagrams from natural language specifications, based on advances in Natural Language Processing (NLP). However, these tools suffer from difficulties due to the inherent imprecision and ambiguity commonly found in natural language expressions. In this article, we present an overview and a study of approaches and tools designed to extract UML diagrams from textual requirements using NLP and computational linguistics techniques. Furthermore, we introduce approaches employing deep learning techniques. Next, we provide a descriptive study and comparative analysis of the limitations and contributions of these automatic and semiautomatic tools, as well as solutions for improving the existing state of the art.",2024,,,,,,3
